codigo,denominacao,atestado_bombeiros,licenca_ambiental,orgão_regulador,defesa_civil,laudo_acustico,outros_docs
51.11-1-00,Transporte aéreo de passageiros regular,M - Especial,-,Autorização ANAC,-,-,-
51.12-9-01,Serviço de táxi aéreo e locação de aeronaves com tripulação,M - Especial,-,Autorização ANAC,-,-,-
51.12-9-99,Outros serviços de transporte aéreo de passageiros não regular,M - Especial,-,Autorização ANAC,-,-,-
51.20-0-00,Transporte aéreo de carga,M - Especial,-,Autorização ANAC,-,-,-
51.30-7-00,Transporte espacial,M - Especial,-,Autorização ANAC,-,-,-
52.11-7-01,Armazéns gerais - emissão de warrant,J - Depósitos,-,-,-,-,-
52.11-7-02,Guarda-móveis,J - Depósitos,-,-,-,-,-
52.11-7-99,"Depósitos de mercadorias para terceiros, exceto armazéns gerais e guarda-móveis",J - Depósitos,-,-,-,-,-
52.21-4-00,"Concessionárias de rodovias, pontes, túneis e serviços relacionados",J - Depósitos,-,-,-,-,-
52.22-2-00,Terminais rodoviários e ferroviários,M - Especial,-,-,-,-,-
52.23-1-00,Estacionamento de veículos,C - Comercial,-,-,-,-,-
52.31-1-01,Administração da infraestrutura portuária,M - Especial,-,-,-,-,-
52.31-1-02,Atividades do Operador Portuário,C - Comercial,-,-,-,-,-
52.31-1-03,Gestão de terminais aquaviários,C - Comercial,-,-,-,-,-
52.40-1-01,Operação dos aeroportos e campos de aterrissagem,C - Comercial,-,-,-,-,-
52.50-8-01,Comissaria de despachos,C - Comercial,-,-,-,-,-
52.12-5-00,Carga e descarga,C - Comercial,-,-,-,-,-
52.29-0-01,"Serviços de apoio ao transporte por táxi, inclusive centrais de chamada",C - Comercial,-,-,-,-,-
52.29-0-02,Serviços de reboque de veículos,C - Comercial,-,-,-,-,-
52.29-0-99,Outras atividades auxiliares dos transportes terrestres não especificadas anteriormente,C - Comercial,-,-,-,-,-
52.32-0-00,Atividades de agenciamento marítimo,C - Comercial,-,-,-,-,-
52.39-7-01,Serviços de praticagem,C - Comercial,-,-,-,-,-
52.39-7-99,Atividades auxiliares dos transportes aquaviários não especificadas anteriormente,C - Comercial,-,-,-,-,-
52.40-1-99,"Atividades auxiliares dos transportes aéreos, exceto operação dos aeroportos e campos de aterrissagem",C - Comercial,-,-,-,-,-
52.50-8-02,Atividades de despachantes aduaneiros,C - Comercial,-,-,-,-,-
52.50-8-03,"Agenciamento de cargas, exceto para o transporte marítimo",C - Comercial,-,-,-,-,-
52.50-8-04,Organização logística do transporte de carga,C - Comercial,-,-,-,-,-
52.50-8-05,Operador de transporte multimodal - OTM,J - Depósitos,-,-,-,-,-
53.10-5-01,Atividades do Correio Nacional,C - Comercial,-,-,-,-,-
53.10-5-02,Atividades de franqueadas e permissionárias do Correio Nacional,C - Comercial,-,-,-,-,-
53.20-2-01,Serviços de malote não realizados pelo Correio Nacional,C - Comercial,-,-,-,-,-
53.20-2-02,Serviços de entrega rápida,D - Serviço Profissional,-,-,-,-,-
55.10-8-01,Hotéis,B - Serviço de Hospedagem,-,-,-,-,-
55.10-8-02,Apart-hotéis,B - Serviço de Hospedagem,-,-,-,-,-
55.10-8-03,Motéis,B - Serviço de Hospedagem,-,-,-,-,-
55.90-6-01,"Albergues, exceto assistenciais",B - Serviço de Hospedagem,-,-,-,-,-
55.90-6-02,Campings,B - Serviço de Hospedagem,-,-,-,-,-
55.90-6-03,Pensões (alojamento),B - Serviço de Hospedagem,-,-,-,-,-
55.90-6-99,Outros alojamentos não especificados anteriormente,B - Serviço de Hospedagem,-,-,-,-,-
56.11-2-01,Restaurantes e similares,F - Local de reunião de público,-,-,-,-,-
56.11-2-05,"Bares e outros estabelecimentos especializados em servir bebidas, com entretenimento",F - Local de reunião de público,-,-,-,Laudo acústico com ART,-
56.11-2-03,"Lanchonetes, casas de chá, de sucos e similares",F - Local de reunião de público,-,-,-,-,-
56.11-2-04,"Bares e outros estabelecimentos especializados em servir bebidas, sem entretenimento",F - Local de reunião de público,-,-,-,-,-
56.20-1-03,Cantinas - serviços de alimentação privativos,F - Local de reunião de público,-,-,-,-,-
56.12-1-00,Serviços ambulantes de alimentação,C - Comercial,-,-,-,-,-
56.20-1-01,Fornecimento de alimentos preparados preponderantemente para empresas,C - Comercial,-,-,-,-,-
56.20-1-02,Serviços de alimentação para eventos e recepções - bufê,C - Comercial,-,-,-,-,-
56.20-1-04,Fornecimento de alimentos preparados preponderantemente para consumo domiciliar,C - Comercial,-,-,-,-,-
58.11-5-00,Edição de livros,C - Comercial,-,-,-,-,-
58.12-3-01,Edição de jornais diários,C - Comercial,-,-,-,-,-
58.12-3-02,Edição de jornais não diários,C - Comercial,-,-,-,-,-
58.13-1-00,Edição de revistas,C - Comercial,-,-,-,-,-
58.19-1-00,"Edição de cadastros, listas e outros produtos gráficos",C - Comercial,-,-,-,-,-
58.21-2-00,Edição integrada à impressão de livros,C - Comercial,-,-,-,-,-
58.22-1-01,Edição integrada à impressão de jornais diários,C - Comercial,-,-,-,-,-
58.22-1-02,Edição integrada à impressão de jornais não diários,C - Comercial,-,-,-,-,-
58.23-9-00,Edição integrada à impressão de revistas,C - Comercial,-,-,-,-,-
58.29-8-00,"Edição integrada à impressão de cadastros, listas e outros produtos gráficos",C - Comercial,-,-,-,-,-
59.11-1-01,Estúdios cinematográficos,C - Comercial,-,-,-,-,-
59.11-1-02,Produção de filmes para publicidade,C - Comercial,-,-,-,-,-
59.11-1-99,"Atividades de produção cinematográfica, de vídeos e de programas de televisão não especificadas anteriormente",C - Comercial,-,-,-,-,-
59.12-0-01,Serviços de dublagem,C - Comercial,-,-,-,-,-
59.12-0-02,Serviços de mixagem sonora em produção audiovisual,C - Comercial,-,-,-,-,-
59.12-0-99,"Atividades de pós-produção cinematográfica, de vídeos e de programas de televisão não especificadas anteriormente",C - Comercial,-,-,-,-,-
59.13-8-00,"Distribuição cinematográfica, de vídeo e de programas de televisão",C - Comercial,-,-,-,-,-
59.14-6-00,Atividades de exibição cinematográfica,C - Comercial,-,-,-,-,-
59.20-1-00,Atividades de gravação de som e de edição de música,C - Comercial,-,-,-,-,-
60.10-1-00,Atividades de rádio,M - Especial,-,Autorização ANATEL,-,-,Atividade CSE - CMGDT
60.21-7-00,Atividades de televisão aberta,M - Especial,-,Autorização ANATEL,-,-,Atividade CSE - CMGDT
60.22-5-01,Programadoras,M - Especial,-,Autorização ANATEL,-,-,Atividade CSE - CMGDT
60.22-5-02,"Atividades relacionadas à televisão por assinatura, exceto programadoras",M - Especial,-,Autorização ANATEL,-,-,Atividade CSE - CMGDT
61.10-8-01,Serviços de telefonia fixa comutada - STFC,M - Especial,-,-,-,-,-
61.10-8-02,Serviços de redes de transporte de telecomunicações - SRTT,M - Especial,-,-,-,-,-
61.10-8-03,Serviços de comunicação multimídia - SCM,M - Especial,-,-,-,-,-
61.10-8-99,Serviços de telecomunicações por fio não especificados anteriormente,M - Especial,-,-,-,-,-
61.20-5-01,Telefonia móvel celular,M - Especial,-,-,-,-,-
61.20-5-02,Serviço móvel especializado - SME,M - Especial,-,-,-,-,-
61.20-5-99,Serviços de telecomunicações sem fio não especificados anteriormente,M - Especial,-,-,-,-,-
61.30-2-00,Telecomunicações por satélite,M - Especial,-,-,-,-,-
61.41-8-00,Operadoras de televisão por assinatura por cabo,M - Especial,-,-,-,-,-
61.42-6-00,Operadoras de televisão por assinatura por micro-ondas,M - Especial,-,-,-,-,-
61.43-4-00,Operadoras de televisão por assinatura por satélite,M - Especial,-,-,-,-,-
61.90-6-01,Provedores de acesso às redes de comunicações,M - Especial,-,-,-,-,-
61.90-6-02,Provedores de voz sobre protocolo Internet - VOIP,M - Especial,-,-,-,-,-
61.90-6-99,Outras atividades de telecomunicações não especificadas anteriormente,M - Especial,-,-,-,-,-
62.01-5-01,Desenvolvimento de programas de computador sob encomenda,C - Comercial,-,-,-,-,-
62.01-5-02,Web desing,C - Comercial,-,-,-,-,-
62.02-3-00,Desenvolvimento e licenciamento de programas de computador customizáveis,C - Comercial,-,-,-,-,-
62.03-1-00,Desenvolvimento e licenciamento de programas de computador não customizáveis,C - Comercial,-,-,-,-,-
62.04-0-00,Consultoria em tecnologia da informação,C - Comercial,-,-,-,-,-
62.09-1-00,"Suporte técnico, manutenção e outros serviços em tecnologia da informação",C - Comercial,-,-,-,-,-
63.11-9-00,"Tratamento de dados, provedores de serviços de aplicação e serviços de hospedagem na Internet",C - Comercial,-,-,-,-,-
63.19-4-00,"Portais, provedores de conteúdo e outros serviços de informação na Internet",C - Comercial,-,-,-,-,-
63.91-7-00,Agências de notícias,C - Comercial,-,-,-,-,-
63.99-2-00,Outras atividades de prestação de serviços de informação não especificadas anteriormente,C - Comercial,-,-,-,-,-
64.10-7-00,Banco Central,C - Comercial,-,-,-,-,-
64.21-2-00,Bancos comerciais,C - Comercial,-,-,-,-,-
64.22-1-00,"Bancos múltiplos, com carteira comercial",C - Comercial,-,-,-,-,-
64.23-9-00,Caixas econômicas,C - Comercial,-,-,-,-,-
64.24-7-01,Bancos cooperativos,C - Comercial,-,-,-,-,-
64.24-7-02,Cooperativas centrais de crédito,C - Comercial,-,-,-,-,-
64.24-7-03,Cooperativas de crédito mútuo,C - Comercial,-,-,-,-,-
64.24-7-04,Cooperativas de crédito rural,C - Comercial,-,-,-,-,-
64.31-0-00,"Bancos múltiplos, sem carteira comercial",C - Comercial,-,-,-,-,-
64.32-8-00,Bancos de investimento,C - Comercial,-,-,-,-,-
64.33-6-00,Bancos de desenvolvimento,C - Comercial,-,-,-,-,-
64.38-7-01,Bancos de câmbio,C - Comercial,-,-,-,-,-
64.38-7-99,Outras instituições de intermediação não monetária não especificadas anteriormente,C - Comercial,-,-,-,-,-
64.34-4-00,Agências de fomento,C - Comercial,-,-,-,-,-
64.35-2-01,Sociedades de crédito imobiliário,C - Comercial,-,-,-,-,-
64.35-2-02,Associações de poupança e empréstimo,C - Comercial,-,-,-,-,-
64.35-2-03,Companhias hipotecárias,C - Comercial,-,-,-,-,-
64.36-1-00,"Sociedades de crédito, financiamento e investimento - financeiras",C - Comercial,-,-,-,-,-
64.37-9-00,Sociedades de crédito ao microempreendedor,C - Comercial,-,-,-,-,-
64.40-9-00,Arrendamento mercantil,C - Comercial,-,-,-,-,-
64.50-6-00,Sociedades de capitalização,C - Comercial,-,-,-,-,-
64.61-1-00,Holdings de instituições financeiras,C - Comercial,-,-,-,-,-
64.62-0-00,Holdings de instituições não financeiras,C - Comercial,-,-,-,-,-
64.63-8-00,"Outras sociedades de participação, exceto holdings",C - Comercial,-,-,-,-,-
64.70-1-01,"Fundos de investimento, exceto previdenciários e imobiliários",C - Comercial,-,-,-,-,-
64.70-1-02,Fundos de investimento previdenciários,C - Comercial,-,-,-,-,-
64.70-1-03,Fundos de investimento imobiliários,C - Comercial,-,-,-,-,-
64.91-3-00,Sociedades de fomento mercantil - factoring,C - Comercial,-,-,-,-,-
64.92-1-00,Securitização de créditos,C - Comercial,-,-,-,-,-
64.93-0-00,Administração de consórcios para aquisição de bens e direitos,C - Comercial,-,-,-,-,-
64.99-9-01,Clubes de investimento,C - Comercial,-,-,-,-,-
64.99-9-02,Sociedades de investimento,C - Comercial,-,-,-,-,-
64.99-9-03,Fundo garantidor de crédito,C - Comercial,-,-,-,-,-
64.99-9-04,Caixas de financiamento de corporações,C - Comercial,-,-,-,-,-
64.99-9-05,Concessão de crédito pelas OSCIP,C - Comercial,-,-,-,-,-
64.99-9-99,Outras atividades de serviços financeiros não especificadas anteriormente,C - Comercial,-,-,-,-,-
65.11-1-01,Sociedade seguradora de seguros vida,C - Comercial,-,-,-,-,-
65.11-1-02,Planos de auxílio-funeral,C - Comercial,-,-,-,-,-
65.12-0-00,Sociedade seguradora de seguros não vida,C - Comercial,-,-,-,-,-
65.20-1-00,Sociedade seguradora de seguros-saúde,C - Comercial,-,-,-,-,-
65.30-8-00,Resseguros,C - Comercial,-,-,-,-,-
65.41-3-00,Previdência complementar fechada,C - Comercial,-,-,-,-,-
65.42-1-00,Previdência complementar aberta,C - Comercial,-,-,-,-,-
65.50-2-00,Planos de saúde,C - Comercial,-,-,-,-,-
66.11-8-01,Bolsa de valores,C - Comercial,-,-,-,-,-
66.11-8-02,Bolsa de mercadorias,C - Comercial,-,-,-,-,-
66.11-8-03,Bolsa de mercadorias e futuros,C - Comercial,-,-,-,-,-
66.11-8-04,Administração de mercados de balcão organizados,C - Comercial,-,-,-,-,-
66.12-6-01,Corretoras de títulos e valores mobiliários,C - Comercial,-,-,-,-,-
66.12-6-02,Distribuidoras de títulos e valores mobiliários,C - Comercial,-,-,-,-,-
66.12-6-03,Corretoras de câmbio,C - Comercial,-,-,-,-,-
66.12-6-04,Corretoras de contratos de mercadorias,C - Comercial,-,-,-,-,-
66.12-6-05,Agentes de investimentos em aplicações financeiras,C - Comercial,-,-,-,-,-
66.13-4-00,Administração de cartões de crédito,C - Comercial,-,-,-,-,-
66.19-3-01,Serviços de liquidação e custódia,C - Comercial,-,-,-,-,-
66.19-3-02,Correspondentes de instituições financeiras,C - Comercial,-,-,-,-,-
66.19-3-03,Representações de bancos estrangeiros,C - Comercial,-,-,-,-,-
66.19-3-04,Caixas eletrônicos,C - Comercial,-,-,-,-,-
66.19-3-05,Operadoras de cartões de débito,C - Comercial,-,-,-,-,-
66.19-3-99,Outras atividades auxiliares dos serviços financeiros não especificadas anteriormente,C - Comercial,-,-,-,-,-
66.21-5-01,Peritos e avaliadores de seguros,C - Comercial,-,-,-,-,-
66.21-5-02,Auditoria e consultoria atuarial,C - Comercial,-,-,-,-,-
66.22-3-00,"Corretores e agentes de seguros, de planos de previdência complementar e de saúde",C - Comercial,-,-,-,-,-
66.29-1-00,"Atividades auxiliares dos seguros, da previdência complementar e dos planos de saúde não especificadas anteriormente",C - Comercial,-,-,-,-,-
66.30-4-00,Atividades de administração de fundos por contrato ou comissão,C - Comercial,-,-,-,-,-
68.10-2-01,Compra e venda de imóveis próprios,C - Comercial,-,-,-,-,-
68.10-2-02,Aluguel de imóveis próprios,C - Comercial,-,-,-,-,-
68.10-2-03,Loteamento de imóveis próprios,C - Comercial,-,-,-,-,-
68.21-8-01,Corretagem na compra e venda e avaliação de imóveis,C - Comercial,-,-,-,-,-
68.21-8-02,Corretagem no aluguel de imóveis,C - Comercial,-,-,-,-,-
68.22-6-00,Gestão e administração da propriedade imobiliária,C - Comercial,-,-,-,-,-
69.11-7-01,Serviços advocatícios,D - Serviço Profissional,-,-,-,-,-
69.11-7-02,Atividades auxiliares da justiça,C - Comercial,-,-,-,-,-
69.11-7-03,Agente de propriedade industrial,C - Comercial,-,-,-,-,-
69.20-6-01,Atividades de contabilidade,D - Serviço Profissional,-,-,-,-,-
69.20-6-02,Atividades de consultoria e auditoria contábil e tributária,D - Serviço Profissional,-,-,-,-,-
69.12-5-00,Cartórios,C - Comercial,-,-,-,-,-
70.20-4-00,"Atividades de consultoria em gestão empresarial, exceto consultoria técnica específica",D - Serviço Profissional,-,-,-,-,-
71.11-1-00,Serviços de arquitetura,D - Serviço Profissional,-,-,-,-,-
71.12-0-00,Serviços de engenharia,D - Serviço Profissional,-,-,-,-,-
71.19-7-01,"Serviços de cartografia, topografia e geodésia",D - Serviço Profissional,-,-,-,-,-
71.19-7-02,Atividades de estudos geológicos,D - Serviço Profissional,-,-,-,-,-
71.19-7-03,Serviços de desenho técnico relacionados à arquitetura e engenharia,D - Serviço Profissional,-,-,-,-,-
71.19-7-04,Serviços de perícia técnica relacionados à segurança do trabalho,D - Serviço Profissional,-,-,-,-,-
71.19-7-99,Atividades técnicas relacionadas à engenharia e arquitetura não especificadas anteriormente,D - Serviço Profissional,-,-,-,-,-
71.20-1-00,Testes e análises técnicas,D - Serviço Profissional,-,-,-,-,-
72.10-0-00,Pesquisa e desenvolvimento experimental em ciências físicas e naturais,D - Serviço Profissional,-,-,-,-,-
72.20-7-00,Pesquisa e desenvolvimento experimental em ciências sociais e humanas,D - Serviço Profissional,-,-,-,-,-
73.11-4-00,Agências de publicidade,D - Serviço Profissional,-,-,-,-,-
73.12-2-00,"Agenciamento de espaços para publicidade, exceto em veículos de comunicação",D - Serviço Profissional,-,-,-,-,-
73.19-0-01,Criação de estandes para feiras e exposições,D - Serviço Profissional,-,-,-,-,-
73.19-0-02,Promoção de vendas,D - Serviço Profissional,-,-,-,-,-
73.19-0-03,Marketing direto,D - Serviço Profissional,-,-,-,-,-
73.19-0-04,Consultoria em publicidade,D - Serviço Profissional,-,-,-,-,-
73.19-0-99,Outras atividades de publicidade não especificadas anteriormente,D - Serviço Profissional,-,-,-,-,-
73.20-3-00,Pesquisas de mercado e de opinião pública,D - Serviço Profissional,-,-,-,-,-
74.10-2-02,Design de interiores,D - Serviço Profissional,-,-,-,-,-
74.10-2-03,Desing de produto,D - Serviço Profissional,-,-,-,-,-
74.10-2-99,Atividades de desing não especificadas anteriormente,D - Serviço Profissional,-,-,-,-,-
74.20-0-01,"Atividades de produção de fotografias, exceto aérea e submarina",D - Serviço Profissional,-,-,-,-,-
74.20-0-02,Atividades de produção de fotografias aéreas e submarinas,D - Serviço Profissional,-,-,-,-,-
74.20-0-03,Laboratórios fotográficos,D - Serviço Profissional,-,-,-,-,-
74.20-0-04,Filmagem de festas e eventos,D - Serviço Profissional,-,-,-,-,-
74.20-0-05,Serviços de microfilmagem,D - Serviço Profissional,-,-,-,-,-
74.90-1-01,"Serviços de tradução, interpretação e similares",D - Serviço Profissional,-,-,-,-,-
74.90-1-02,Escafandria e mergulho,D - Serviço Profissional,-,-,-,-,-
74.90-1-03,Serviços de agronomia e de consultoria às atividades agrícolas e pecuárias,D - Serviço Profissional,-,-,-,-,-
74.90-1-04,"Atividades de intermediação e agenciamento de serviços e negócios em geral, exceto imobiliários",D - Serviço Profissional,-,-,-,-,-
74.90-1-05,"Agenciamento de profissionais para atividades esportivas, culturais e artísticas",D - Serviço Profissional,-,-,-,-,-
74.90-1-99,"Outras atividades profissionais, científicas e técnicas não especificadas anteriormente",D - Serviço Profissional,-,-,-,-,-
75.00-1-00,Atividades veterinárias,C - Comercial,-,-,-,-,-
77.11-0-00,Locação de automóveis sem condutor,C - Comercial,-,-,-,-,-
77.19-5-01,"Locação de embarcações sem tripulação, exceto para fins recreativos",C - Comercial,-,-,-,-,-
77.19-5-02,Locação de aeronaves sem tripulação,C - Comercial,-,-,-,-,-
77.19-5-99,"Locação de outros meios de transporte não especificados anteriormente, sem condutor",C - Comercial,-,-,-,-,-
77.21-7-00,Aluguel de equipamentos recreativos e esportivos,C - Comercial,-,-,-,-,-
77.22-5-00,"Aluguel de fitas de vídeo, DVDs e similares",C - Comercial,-,-,-,-,-
77.23-3-00,"Aluguel de objetos do vestuário, jóias e acessórios",C - Comercial,-,-,-,-,-
77.29-2-01,Aluguel de aparelhos de jogos eletrônicos,C - Comercial,-,-,-,-,-
77.29-2-02,"Aluguel de móveis, utensílios e aparelhos de uso doméstico e pessoal; instrumentos musicais",C - Comercial,-,-,-,-,-
77.29-2-03,Aluguel de material médico,C - Comercial,-,-,-,-,-
77.29-2-99,Aluguel de outros objetos pessoais e domésticos não especificados anteriormente,C - Comercial,-,-,-,-,-
77.31-4-00,Aluguel de máquinas e equipamentos agrícolas sem operador,C - Comercial,-,-,-,-,-
77.32-2-01,"Aluguel de máquinas e equipamentos para construção sem operador, exceto andaimes",C - Comercial,-,-,-,-,-
77.32-2-02,Aluguel de andaimes,C - Comercial,-,-,-,-,-
77.33-1-00,Aluguel de máquinas e equipamentos para escritório,C - Comercial,-,-,-,-,-
77.39-0-01,"Aluguel de máquinas e equipamentos para extração de minérios e petróleo, sem operador",C - Comercial,-,-,-,-,-
77.39-0-02,"Aluguel de equipamentos científicos, médicos e hospitalares, sem operador",C - Comercial,-,-,-,-,-
77.39-0-03,"Aluguel de palcos, coberturas e outras estruturas de uso temporário, exceto andaimes",C - Comercial,-,-,-,-,-
77.39-0-99,"Aluguel de outras máquinas e equipamentos comerciais e industriais não especificados anteriormente, sem operador",C - Comercial,-,-,-,-,-
77.40-3-00,Gestão de ativos intangíveis não financeiros,C - Comercial,-,-,-,-,-
78.10-8-00,Seleção e agenciamento de mão de obra,C - Comercial,-,-,-,-,-
78.20-5-00,Locação de mão de obra temporária,C - Comercial,-,-,-,-,-
78.30-2-00,Fornecimento e gestão de recursos humanos para terceiros,C - Comercial,-,-,-,-,-
79.11-2-00,Agências de viagens,C - Comercial,-,-,-,-,-
79.12-1-00,Operadores turísticos,C - Comercial,-,-,-,-,-
79.90-2-00,Serviços de reservas e outros serviços de turismo não especificados anteriormente,C - Comercial,-,-,-,-,-
80.11-1-01,Atividades de vigilância e segurança privada,C - Comercial,-,Autorização do Exército,-,-,-
80.11-1-02,Serviços de adestramento de cães de guarda,C - Comercial,-,-,-,-,-
80.12-9-00,Atividades de transporte de valores,C - Comercial,-,-,-,-,-
80.20-0-01,Atividades de monitoramento de sistemas de segurança eletrônico,C - Comercial,-,-,-,-,-
80.20-0-02,Outras atividades de serviços de segurança,C - Comercial,-,-,-,-,-
80.30-7-00,Atividades de investigação particular,C - Comercial,-,-,-,-,-
81.11-7-00,"Serviços combinados para apoio a edifícios, exceto condomínios prediais",C - Comercial,-,-,-,-,-
81.21-4-00,Limpeza em prédios e em domicílios,C - Comercial,-,-,-,-,-
81.29-0-00,Atividades de limpeza não especificadas anteriormente,C - Comercial,-,-,-,-,-
81.30-3-00,Atividades paisagísticas,C - Comercial,-,-,-,-,-
81.12-5-00,Condomínios prediais,C - Comercial,-,-,-,-,-
81.22-2-00,Imunização e controle de pragas urbanas,C - Comercial,-,-,-,-,-
82.11-3-00,Serviços combinados de escritório e apoio administrativo,C - Comercial,-,-,-,-,-
82.19-9-01,Fotocópias,C - Comercial,-,-,-,-,-
82.19-9-99,Preparação de documentos e serviços especializados de apoio administrativo não especificados anteriormente,C - Comercial,-,-,-,-,-
82.20-2-00,Atividades de teleatendimento,C - Comercial,-,-,-,-,-
82.30-0-01,"Serviços de organização de feiras, congressos, exposições e festas",C - Comercial,-,-,-,-,-
82.91-1-00,Atividades de cobrança e informações cadastrais,C - Comercial,-,-,-,-,-
82.99-7-01,"Medição de consumo de energia elétrica, gás e água",C - Comercial,-,-,-,-,-
82.99-7-02,"Emissão de vales-alimentação, vales-transporte e similares",C - Comercial,-,-,-,-,-
82.99-7-03,"Serviços de gravação de carimbos, exceto confecção",C - Comercial,-,-,-,-,-
82.99-7-04,Leiloeiros independentes,C - Comercial,-,-,-,-,-
82.99-7-05,Serviços de levantamento de fundos sob contrato,C - Comercial,-,-,-,-,-
82.99-7-99,Outras atividades de serviços prestados principalmente às empresas não especificadas anteriormente,C - Comercial,-,Autorização DETRAN - Vistoria veicular,-,-,-
82.30-0-02,Casas de festas e eventos,F - Local de reunião de público,-,-,-,Laudo acústico com ART,-
82.99-7-06,Casas lotéricas,C - Comercial,-,Autorização CEF,-,-,-
82.92-0-00,Envasamento e empacotamento sob contrato,C - Comercial,-,-,-,-,-
82.99-7-07,Salas de acesso à Internet,C - Comercial,-,-,-,-,-
84.11-6-00,Administração pública em geral,D - Serviço Profissional,-,-,-,-,-
84.12-4-00,"Regulação das atividades de saúde, educação, serviços culturais e outros serviços sociais",D - Serviço Profissional,-,-,-,-,-
84.13-2-00,Regulação das atividades econômicas,D - Serviço Profissional,-,-,-,-,-
84.21-3-00,Relações exteriores,D - Serviço Profissional,-,-,-,-,-
84.22-1-00,Defesa,D - Serviço Profissional,-,-,-,-,-
84.23-0-00,Justiça,D - Serviço Profissional,-,-,-,-,-
84.24-8-00,Segurança e ordem pública,D - Serviço Profissional,-,-,-,-,-
84.25-6-00,Defesa Civil,D - Serviço Profissional,-,-,-,-,-
84.30-2-00,Seguridade social obrigatória,D - Serviço Profissional,-,-,-,-,-
85.11-2-00,Educação infantil - creche,E - Educacional e Cultura física,-,Autorização COMED,-,-,-
85.12-1-00,Educação infantil - pré-escola,E - Educacional e Cultura física,-,Autorização COMED,-,-,-
85.13-9-00,Ensino fundamental,E - Educacional e Cultura física,-,-,-,-,-
85.20-1-00,Ensino médio,E - Educacional e Cultura física,-,-,-,-,-
85.31-7-00,Educação superior - graduação,E - Educacional e Cultura física,-,-,-,-,-
85.32-5-00,Educação superior - graduação e pós-graduação,E - Educacional e Cultura física,-,-,-,-,-
85.33-3-00,Educação superior - pós-graduação e extensão,E - Educacional e Cultura física,-,-,-,-,-
85.41-4-00,Educação profissional de nível técnico,E - Educacional e Cultura física,-,-,-,-,-
85.42-2-00,Educação profissional de nível tecnológico,E - Educacional e Cultura física,-,-,-,-,-
85.50-3-01,Administração de caixas escolares,E - Educacional e Cultura física,-,-,-,-,-
85.50-3-02,"Atividades de apoio à educação, exceto caixas escolares",E - Educacional e Cultura física,-,-,-,-,-
85.91-1-00,Ensino de esportes,E - Educacional e Cultura física,-,-,-,-,-
85.92-9-01,Ensino de dança,E - Educacional e Cultura física,-,-,-,-,-
85.92-9-02,"Ensino de artes cênicas, exceto dança",E - Educacional e Cultura física,-,-,-,-,-
85.92-9-03,Ensino de música,E - Educacional e Cultura física,-,-,-,-,-
85.92-9-99,Ensino de arte e cultura não especificado anteriormente,E - Educacional e Cultura física,-,-,-,-,-
85.93-7-00,Ensino de idiomas,E - Educacional e Cultura física,-,-,-,-,-
85.99-6-01,Formação de condutores,E - Educacional e Cultura física,-,-,-,-,-
85.99-6-02,Cursos de pilotagem,E - Educacional e Cultura física,-,-,-,-,-
85.99-6-03,Treinamento em informática,E - Educacional e Cultura física,-,-,-,-,-
85.99-6-04,Treinamento em desenvolvimento profissional e gerencial,E - Educacional e Cultura física,-,-,-,-,-
85.99-6-05,Cursos preparatórios para concursos,E - Educacional e Cultura física,-,-,-,-,-
85.99-6-99,Outras atividades de ensino não especificadas anteriormente,E - Educacional e Cultura física,-,-,-,-,-
86.10-1-01,"Atividades de atendimento hospitalar, exceto pronto-socorro e unidades para atendimento a urgências",H - Serviço de saúde e institucional,-,-,-,-,-
